Company,Valuation,Date Joined,Industry,City,Country,Continent,Year Founded,Funding,Select Investors
Hotmart,$1B,17-03-2020,E-commerce & direct-to-consumer,Amsterdam,Netherlands,Europe,2011,$127M,"Technology Crossover Ventures, Alkeon Capital Management, General Atlantic"
Everlaw,$2B,10-03-2020,Internet software & services,Oakland,United States,North America,2010,$299M,"K9 Ventures, Menlo Ventures, Andreessen Horowitz"
InSightec,$1B,06-03-2020,Health,Tirat Carmel,Israel,Asia,1999,$633M,"York Capital Management, GE Healthcare, Koch Disruptive Technologies"
Genki Forest,$15B,01-03-2020,Consumer & retail,Beijing,China,Asia,2016,$721M,"Sequoia Capital China, Longfor Capitalm, Gaorong Capital"
Course Hero,$4B,12-02-2020,Edtech,Redwood City,United States,North America,2006,$477M,"NewView Capital, Maveron, Ridge Ventures"
Skydance Media,$2B,11-02-2020,Other,Santa Monica,United States,North America,2010,$275M,"RedBird Capital Partners, CJ ENM, Tencent Holdings"
FirstCry,$2B,07-02-2020,E-commerce & direct-to-consumer,Pune,India,Asia,2010,$441M,"SoftBank Group, SAIF Partners India, Valiant Capital Partners"
Alto Pharmacy,$1B,30-01-2020,Health,San Francisco,United States,North America,2015,$524M,"Jackson Square Ventures, Greenoaks Capital Management, Softbank Group"
Verkada,$2B,29-01-2020,Cybersecurity,San Mateo,United States,North America,2016,$139M,"next47, First Round Capital, Sequoia Capital"
Justworks,$1B,28-01-2020,Internet software & services,New York,United States,North America,2012,$143M,"Index Ventures, Thrive Capital, Bain Capital Ventures"
Moon Active,$5B,26-01-2020,Mobile & telecommunications,Tel Aviv,Israel,Asia,2011,$425M,"Insight Partners, Andalusian Capital Partners"
Pine Labs,$5B,24-01-2020,Fintech,Noida,India,Asia,1998,$903M,"Sequoia Capital India, Temasek, PayPal Ventures"
Snyk,$9B,21-01-2020,Cybersecurity,Boston,United States,North America,2015,$1B,"BOLDstart Ventures, Google Ventures, Accel"
AppsFlyer,$2B,21-01-2020,Mobile & telecommunications,San Francisco,United States,North America,2011,$293M,"Magma Venture Partners, Pitango Venture Capital, Qumra Capital"
Sisense,$1B,09-01-2020,Data management & analytics,New York,United States,North America,2004,$274M,"Opus Capital, Genesis Partners, Battery Ventures"
HighRadius,$3B,07-01-2020,Fintech,Houston,United States,North America,2006,$475M,"Susquehanna Growth Equity, Citi Ventures, ICONIQ Capital"
Loft,$3B,03-01-2020,E-commerce & direct-to-consumer,Sao Paulo,Brazil,South America,2018,$788M,"Monashees+, Andreessen Horowitz, QED Investors"
Ripple,$10B,20-12-2019,Fintech,San Francisco,United States,North America,2012,$294M,"IDG Capital, Venture51, Lightspeed Venture Partners"
Lenskart,$4B,20-12-2019,E-commerce & direct-to-consumer,Faridabad,India,Asia,2008,$776M,"Chiratae Ventures, PremjiInvest, Softbank"
TELD,$1B,16-12-2019,Fintech,Qingdao,China,Asia,2014,$396M,"China Reform Fund, Gaopeng Capital, Jinhui Xingye"
Wildlife Studios,$3B,05-12-2019,Other,Sao Paulo,Brazil,South America,2011,$180M,"Benchmark, Bessemer Venture Partners"
Dataiku,$5B,04-12-2019,Internet software & services,New York,United States,North America,2013,$647M,"Alven Capital, FirstMark Capital, capitalG"
Rapyd,$15B,03-12-2019,Fintech,London,United Kingdom,Europe,2016,$770M,"Target Global, General Catalyst, Durable Capital Partners"
Vinted,$5B,27-11-2019,E-commerce & direct-to-consumer,Vilnius,Lithuania,Europe,2008,$562M,"Accel, Insight Partners, Burda Principal Investments"
The Brandtech Group,$1B,19-11-2019,Other,New York,United States,North America,2015,$610M,Undisclosed
Guild Education,$4B,13-11-2019,Internet software & services,Denver,United States,North America,2015,$379M,"General Atlantic, Blackstone, ICONIQ Growth"
MUSINSA,$2B,11-11-2019,E-commerce & direct-to-consumer,Seoul,South Korea,Asia,2001,$287M,Sequoia Capital
Faire,$12B,30-10-2019,Artificial intelligence,San Francisco,United States,North America,2017,$1B,"Khosla Ventures, Forerunner Ventures, Sequoia Capital"
Scopely,$3B,29-10-2019,Mobile & telecommunications,Culver City,United States,North America,2011,$999M,"Greycroft, Sands Capital, Revolution Growth"
Kujiale,$1B,25-10-2019,Internet software & services,Hangzhou,China,Asia,2011,$235M,"GGV Capital, IDG Capital, Linear Venture"
KK Group,$3B,23-10-2019,E-commerce & direct-to-consumer,Dongguan,China,Asia,2014,$612M,"Matrix Partners China, Bright Venture Capita, Shenzhen Capital Group"
Instabase,$1B,21-10-2019,Data management & analytics,San Francisco,United States,North America,2015,$132M,"New Enterprise Associates, Greylock Partners, Andreessen Horowitz"
Pendo,$3B,17-10-2019,Internet software & services,Raleigh,United States,North America,2013,$357M,"Contour Venture Partners, Battery Ventures, Core Capital Partners"
EBANX,$1B,16-10-2019,Fintech,Curitiba,Brazil,South America,2012,$460M,"FTV Capital, Endeavor"
Grammarly,$13B,10-10-2019,Internet software & services,San Francisco,United States,North America,2009,$400M,"General Catalyst, Institutional Venture Partners, Breyer Capital"
Huaqin Telecom Technology,$2B,08-10-2019,Mobile & telecommunications,Shanghai,China,Asia,2005,$298M,"Zhangjiang Haocheng Venture Capital, Walden International, Intel Capital"
Next Insurance,$4B,07-10-2019,Fintech,Palo Alto,United States,North America,2016,$881M,"Zeev Ventures, Ribbit Capital, TLV Partners"
Workrise,$3B,30-09-2019,Internet software & services,Austin,United States,North America,2014,$722M,"Founders Fund, Quantum Energy Partners, Bedrock Capital"
Checkr,$5B,19-09-2019,Internet software & services,San Francisco,United States,North America,2014,$559M,"Y Combinator, Accel, T. Rowe Price"
Acronis,$3B,18-09-2019,Cybersecurity,Schaffhausen,Switzerland,Europe,2003,$408M,"Goldman Sachs, VebVentures, Insight Partners"
CMR Surgical,$3B,17-09-2019,Health,Cambridge,United Kingdom,Europe,2014,$975M,"Cambridge Innovation Capital, LGT Capital Partners, Escala Capital"
Anduril,$5B,11-09-2019,Artificial intelligence,Irvine,United States,North America,2017,$691M,"Andreessen Horowitz, Founders Fund, Revolution Ventures"
QuintoAndar,$5B,09-09-2019,E-commerce & direct-to-consumer,Campinas,Brazil,South America,2012,$755M,"Kaszek Ventures, General Atlantic, SoftBank Group"
Grove Collaborative,$1B,06-09-2019,E-commerce & direct-to-consumer,San Francisco,United States,North America,2016,$475M,"MHS Capital, NextView Ventures, Mayfield Fund"
Numbrs,$1B,22-08-2019,Fintech,Zurich,Switzerland,Europe,1999,$105M,"Investment Corporation of Dubai, Centralway"
C2FO,$1B,07-08-2019,Fintech,Leawood,United States,North America,2008,$538M,"Union Square Ventures, Summerhill Venture Partners, Mithril Capital Management"
Cybereason,$3B,06-08-2019,Cybersecurity,Boston,United States,North America,2012,$714M,"SoftBank Group, CRV, Spark Capital"
Ibotta,$1B,06-08-2019,Fintech,Denver,United States,North America,2011,$93M,"Koch Disruptive Technologies, Teamworthy Ventures, GGV Capital"
Scale AI,$7B,05-08-2019,Artificial intelligence,San Francisco,United States,North America,2018,$603M,"Accel, Y Combinator, Index Ventures"
SmartNews,$2B,05-08-2019,Mobile & telecommunications,Tokyo,Japan,Asia,2012,$410M,"Japan Post Capital, Globis Capital Partners, Atomico"
Lightricks,$2B,31-07-2019,Artificial intelligence,Jerusalem,Israel,Asia,2013,$305M,"Viola Ventures, Insight Partners, ClalTech, Goldman Sachs"
DataRobot,$6B,29-07-2019,Artificial intelligence,Boston,United States,North America,2012,$1B,"New Enterprise Associates, Accomplice, IA Ventures"
OpenAI,$3B,22-07-2019,Artificial intelligence,San Francisco,United States,North America,2015,$1B,Khosla Ventures
Trax,$3B,22-07-2019,Artificial intelligence,,Singapore,Asia,2010,$1B,"Hopu Investment Management, Boyu Capital, DC Thomson Ventures"
FlixBus,$3B,18-07-2019,Auto & transportation,Munich,Germany,Europe,2013,$1B,"Holtzbrinck Ventures, Unternehmertum Venture Capital, General Atlantic"
Icertis,$5B,17-07-2019,Artificial intelligence,Bellevue,United States,North America,2009,$371M,"Eight Roads Ventures, Greycroft, Ignition Partners"
SumUp,$1B,16-07-2019,Fintech,London,United Kingdom,Europe,2011,$1B,"American Express Ventures, Goldman Sachs, Bain Capital Credit"
Argo AI,$12B,12-07-2019,Artificial intelligence,Pittsburgh,United States,North America,2016,$4B,"Volkswagen Group, Ford Autonomous Vehicles"
OneTrust,$5B,11-07-2019,Internet software & services,Atlanta,United States,North America,2016,$926M,Insight Partners
Rivigo,$1B,11-07-2019,"Supply chain, logistics, & delivery",Gurgaon,India,Asia,2014,$247M,"SAIF Partners India, Warburg Pincus, Trifecta Capital Advisors"
Ola Electric Mobility,$5B,02-07-2019,Auto & transportation,Bengaluru,India,Asia,2019,$761M,"SoftBank Group, Tiger Global Management, Matrix Partners India"
HEYTEA,$2B,01-07-2019,Other,Shenzhen,China,Asia,2012,$594M,"Sequoia Capital China, Tencent Investment, BA Capital"
Miaoshou Doctor,$1B,27-06-2019,E-commerce & direct-to-consumer,Beijing,China,Asia,2015,$947M,"Sequoia Capital China, Qiming Venture Partners, Tencent Holdings"
Ouyeel,$1B,27-06-2019,Internet software & services,Shanghai,China,Asia,2015,$432M,Taigang Venture Capital
StockX,$4B,26-06-2019,E-commerce & direct-to-consumer,Detroit,United States,North America,2016,$495M,"Google Ventures, Battery Ventures, DST Global"
Kraken,$4B,25-06-2019,Fintech,San Francisco,United States,North America,2011,$119M,"Bnk To The Future, Trammell Ventures, SBI Investment"
Druva,$2B,20-06-2019,Data management & analytics,Sunnyvale,United States,North America,2007,$475M,"Nexus Venture Partners, Tenaya Capital, Sequoia Capital"
Meero,$1B,18-06-2019,Artificial intelligence,Paris,France,Europe,2016,$293M,"Aglae Ventures, Global Founders Capital, Alven Capital"
Collective Health,$2B,17-06-2019,Fintech,San Francisco,United States,North America,2013,$719M,"New Enterprise Associates, Founders Fund, Google Ventures"
Northvolt,$12B,12-06-2019,Other,Stockholm,Sweden,Europe,2016,$4B,"Vattenfall, Volkswagen Group, Goldman Sachs"
Gympass,$2B,12-06-2019,Internet software & services,New York,United States,North America,2012,$525M,"General Atlantic, SoftBank Group, Atomico"
Yanolja,$9B,10-06-2019,Travel,Seoul,South Korea,Asia,2005,$2B,"SBI Investment Korea, Partners Investment, GIC"
Loggi,$2B,05-06-2019,"Supply chain, logistics, & delivery",Sao Paulo,Brazil,South America,2013,$507M,"Qualcomm Ventures, SoftBank Group, Monashees+"
Bordrin Motors,$1B,03-06-2019,Auto & transportation,Shanghai,China,Asia,2016,$362M,"China Grand Prosperity Investment, CSC Group"
Aprogen,$1B,31-05-2019,Health,Seongnam-Si,South Korea,Asia,2000,$62M,"Lindeman Asia Investment, Nichi-Iko Pharmaceutical"
KnowBox,$1B,30-05-2019,Edtech,Beijing,China,Asia,2014,$306M,"TAL Education Group, Legend Star, Alibaba Group"
Mafengwo,$2B,23-05-2019,Travel,Beijing,China,Asia,2010,$503M,"Qiming Venture Partners, Capital Today, General Atlantic"
Ivalua,$1B,21-05-2019,Fintech,Redwood City,United States,North America,2000,$134M,"Ardian, Tiger Global Management, KKR"
Zipline,$3B,20-05-2019,"Supply chain, logistics, & delivery",South San Francisco,United States,North America,2014,$483M,"Sequoia Capital, Baillie Gifford & Co., Google Ventures"
SITECH DEV,$1B,16-05-2019,Other,Guiyang,China,Asia,2017,Unknown,China Prosperity Capital
GetYourGuide,$1B,16-05-2019,Travel,Berlin,Germany,Europe,2009,$656M,"Spark Capital, Highland Europe, Sunstone Capital"
Away,$1B,15-05-2019,E-commerce & direct-to-consumer,New York,United States,North America,2015,$181M,"Global Founders Capital, Comcast Ventures, Forerunner Ventures"
Impossible Foods,$7B,13-05-2019,Consumer & retail,Redwood City,United States,North America,2011,$2B,"Khosla Ventures, Horizons Ventures, Temasek Holdings"
VTS,$1B,07-05-2019,Internet software & services,New York,United States,North America,2012,$187M,"Trinity Ventures, Fifth Wall Ventures, OpenView Venture Partners"
Carta,$7B,06-05-2019,Fintech,San Francisco,United States,North America,2012,$1B,"Menlo Ventures, Spark Capital, Union Square Ventures"
PolicyBazaar,$2B,06-05-2019,Fintech,Gurgaon,India,Asia,2008,$634M,"Info Edge, Softbank Capital"
Checkout.com,$40B,02-05-2019,Fintech,London,United Kingdom,Europe,2012,$2B,"Tiger Global Management, Insight Partners, DST Global"
Poizon,$1B,29-04-2019,Mobile & telecommunications,Shanghai,China,Asia,2015,Unknown,"DST Global, Sequoia Capital China, Gaorong Capital"
Tongdun Technology,$1B,25-04-2019,Cybersecurity,Hangzhou,China,Asia,2013,$252M,"Advantech Capital, Temasek Holdings Ltd., Tiantu Capital Co."
KeepTruckin,$2B,23-04-2019,"Supply chain, logistics, & delivery",San Francisco,United States,North America,2013,$417M,"Google Ventures, Index Ventures, Scale Venture Partners"
Outreach,$4B,16-04-2019,Internet software & services,Seattle,United States,North America,2011,$489M,"Mayfield Fund, M12, Trinity Ventures"
Sila Nanotechnologies,$3B,16-04-2019,Other,Alameda,United States,North America,2011,$880M,"Bessemer Venture Partners, Sutter Hill Ventures, Matrix Partners"
ENOVATE,$2B,15-04-2019,Auto & transportation,Shanghai,China,Asia,2015,$1B,Automobile Industry Guidance Fund
Dream11,$8B,09-04-2019,Internet software & services,Mumbai,India,Asia,2007,$2B,"Kaalari Capital, Tencent Holdings, Steadview Capital"
ezCater,$2B,02-04-2019,"Supply chain, logistics, & delivery",Boston,United States,North America,2007,$421M,"Insight Venture Partners, ICONIQ Capital, Launchpad Venture Group"
Kaseya,$2B,27-03-2019,Cybersecurity,Miami,United States,North America,2000,$545M,"Insight Partners, TPG Alternative & Renewable Technologies, Ireland Strategic Investment Fund"
Mininglamp Technology,$1B,27-03-2019,Artificial intelligence,Beijing,China,Asia,2014,$787M,"Russia-China Investment Fund, Tencent Holdings, Sequoia Capital China"
Airwallex,$6B,25-03-2019,Fintech,Melbourne,Australia,Oceania,2015,$802M,"DST Global, Sequoia Capital China, Tencent Holdings"
Baiwang,$2B,25-03-2019,Fintech,Beijing,China,Asia,2015,$224M,"Guozhong Venture Capital Management, Shenzhen Capital Group, Oriental Fortune Capital"
Intellifusion,$1B,22-03-2019,Artificial intelligence,Shenzhen,China,Asia,2014,$173M,"BOC International, TopoScend Capital, Hongxiu VC"
Doctolib,$6B,19-03-2019,Health,Paris,France,Europe,2013,$815M,"BPI France, Kerala Ventures, Accel"
Glossier,$2B,19-03-2019,Consumer & retail,New York,United States,North America,2014,$266M,"Forerunner Ventures, Institutional Venture Partners, Thrive Capital"
Yipin Shengxian,$1B,11-03-2019,E-commerce & direct-to-consumer,Hefei,China,Asia,2017,$658M,"Eastern Bell Capital, Capital Today, Longzhu Capital"
WM Motor,$5B,08-03-2019,Auto & transportation,Shanghai,China,Asia,2015,$4B,"Baidu Capital, Linear Venture, Tencent"
Chime,$25B,05-03-2019,Fintech,San Francisco,United States,North America,2013,$2B,"Forerunner Ventures, Crosslink Capital, Homebrew"
wefox,$3B,05-03-2019,Fintech,Berlin,Germany,Europe,2014,$919M,"Salesforce Ventures, Seedcamp, OMERS Ventures"
OCSiAl,$2B,04-03-2019,Other,Leudelange,Luxembourg,Europe,2012,$285M,"A&NN, Rusnano"
Carzone,$2B,01-03-2019,E-commerce & direct-to-consumer,Jiangsu,China,Asia,1995,$946M,"Alibaba Group,Co-Stone Venture Capital, Buhuo Venture Capital"
Horizon Robotics,$4B,27-02-2019,Artificial intelligence,Beijing,China,Asia,2015,$2B,"Hillhouse Capital Management, Linear Venture, Morningside Venture Capital"
Delhivery,$3B,27-02-2019,"Supply chain, logistics, & delivery",Gurgaon,India,Asia,2011,$1B,"Times Internet, Nexus Venture Partners, SoftBank Group"
Lalamove,$10B,21-02-2019,"Supply chain, logistics, & delivery",Cheung Sha Wan,Hong Kong,Asia,2013,$2B,"MindWorks Ventures, Shunwei Capital Partners, Xiang He Capital"
Ynsect,$1B,21-02-2019,Other,Evry,France,Europe,2011,$393M,"Astanor Ventures, Upfront Ventures, IDInvest Partners"
OVO Energy,$1B,14-02-2019,Other,Bristol,United Kingdom,Europe,2009,$324M,"Mitsubishi Corporation, Mayfair Equity Partners"
Nuro,$9B,11-02-2019,Auto & transportation,Mountain View,United States,North America,2016,$2B,"SoftBank Group, Greylock Partners, Gaorong Capital"
Calm,$2B,06-02-2019,Consumer & retail,San Francisco,United States,North America,2012,$218M,"Insight Venture Partners, TPG Growth, Sound Ventures"
Databricks,$38B,05-02-2019,Data management & analytics,San Francisco,United States,North America,2013,$3B,"Andreessen Horowitz, New Enterprise Associates, Battery Ventures"
eDaili,$2B,01-02-2019,E-commerce & direct-to-consumer,Shanghai,China,Asia,2015,$101M,"K2VC, Lightspeed China Partners, Sky9 Capital"
Collibra,$5B,29-01-2019,Data management & analytics,Brussels,Belgium,Europe,2008,$596M,"Index Ventures, Battery Ventures, ICONIQ Capital"
Globality,$1B,22-01-2019,Artificial intelligence,Menlo Park,United States,North America,2015,$310M,SoftBank Group
Yimidida,$1B,14-01-2019,"Supply chain, logistics, & delivery",Shanghai,China,Asia,2015,$554M,"Source Code Capital, Global Logistic Properties, K2VC"
N26,$9B,10-01-2019,Fintech,Berlin,Germany,Europe,2013,$2B,"Redalpine Venture Partners, Earlybird Venture Capital, Valar Ventures"
Fair,$1B,20-12-2018,Auto & transportation,Santa Monica,United States,North America,2016,$2B,"CreditEase Fintech Investment Fund, BMW i Ventures, SoftBank Group"
Cambridge Mobile Telematics,$2B,19-12-2018,Mobile & telecommunications,Cambridge,United States,North America,2010,$503M,SoftBank Group
4Paradigm,$2B,19-12-2018,Artificial intelligence,Beijing,China,Asia,2015,$1B,"Sequoia Capital China, China Construction Bank, Bank of China"
Graphcore,$3B,18-12-2018,Artificial intelligence,Bristol,United Kingdom,Europe,2016,$682M,"Dell Technologies Capital, Pitango Venture Capital, Amadeus Capital Partners"
Seismic,$3B,18-12-2018,Internet software & services,San Diego,United States,North America,2010,$427M,"Jackson Square Ventures, General Atlantic, Lightspeed Venture Partners"
Plaid,$13B,11-12-2018,Fintech,San Francisco,United States,North America,2012,$734M,"New Enterprise Associates, Spar Capital, Index Ventures"
REEF Technology,$1B,10-12-2018,"Supply chain, logistics, & delivery",Miami,United States,North America,2015,$2B,"Target Global, UBS Asset Management, Mubadala Capital"
Toss,$7B,09-12-2018,Fintech,Seoul,South Korea,Asia,2013,$844M,"Bessemer Venture Partners, Qualcomm Ventures, Kleiner Perkins Caufield & Byers"
Juma Peisong,$1B,26-11-2018,"Supply chain, logistics, & delivery",Chengdu,China,Asia,2011,$281M,"Ding Xiang Capital, New Hope Fund, Sino-Ocean Capital"
Geek+,$1B,21-11-2018,Hardware,Beijing,China,Asia,2015,$439M,"Volcanics Ventures, Vertex Ventures China, Warburg Pincus"
Leap Motor,$1B,20-11-2018,Auto & transportation,Hangzhou,China,Asia,2015,$1B,"Sequoia Capital China, Gopher Asset Management, Shanghai Electric Group"
Airtable,$12B,15-11-2018,Internet software & services,San Francisco,United States,North America,2013,$1B,"Caffeinated Capital, CRV, Founder Collective"
ServiceTitan,$10B,14-11-2018,Internet software & services,Glendale,United States,North America,2012,$1B,"Bessemer Venture Partners, ICONIQ Capital, Battery Ventures"
Cerebras Systems,$4B,14-11-2018,Hardware,Los Altos,United States,North America,2016,$720M,"Benchmark, Foundation Capital, Sequoia Capital"
Netskope,$8B,13-11-2018,Cybersecurity,Santa Clara,United States,North America,2012,$1B,"Lightspeed Venture Partners, Social Capital, Accel"
iFood,$1B,13-11-2018,"Supply chain, logistics, & delivery",Osasco,Brazil,South America,2011,$592M,"Movile, Just Eat, Naspers"
TripActions,$7B,08-11-2018,Travel,Palo Alto,United States,North America,2015,$912M,"Andreessen Horowitz, Lightspeed Venture Partners, Zeev Ventures"
BitFury,$1B,06-11-2018,Hardware,Amsterdam,Netherlands,Europe,2011,$170M,"Georgian Co-Investment Fund, iTech Capital, Galaxy Digital"
Zume,$2B,01-11-2018,Consumer & retail,Mountain View,United States,North America,2015,$423M,"Softbank Group, AME Cloud Ventures, SignalFire"
Monzo,$5B,31-10-2018,Fintech,London,United Kingdom,Europe,2015,$1B,"Passion Capital, Thrive Capital, Orange Digital Ventures"
Epic Games,$32B,26-10-2018,Other,Cary,United States,North America,1991,$7B,"Tencent Holdings, KKR, Smash Ventures"
TERMINUS Technology,$1B,25-10-2018,Hardware,Beijing,China,Asia,2015,$623M,"China Everbright Limited, IDG Capital, iFLYTEK"
Omio,$1B,23-10-2018,Travel,Berlin,Germany,Europe,2013,$396M,"Lakestar, Battery Ventures, New Enterprise Associates"
PAX,$2B,22-10-2018,Consumer & retail,San Francisco,United States,North America,2007,$542M,"Tao Capital Partners, Global Asset Capital, Tiger Global Management"
GPclub,$1B,22-10-2018,Other,Seoul,South Korea,Asia,2003,$67M,Goldman Sachs
Hosjoy,$1B,18-10-2018,E-commerce & direct-to-consumer,Nanjing,China,Asia,2009,$139M,"U.S.-China Green Fund, Founder H Fund, Richland Equities"
Momenta,$1B,17-10-2018,Artificial intelligence,Beijing,China,Asia,2016,$1B,"Sinovation Ventures, Tencent Holdings, Sequoia Capital China"
Devoted Health,$13B,16-10-2018,Health,Waltham,United States,North America,2017,$2B,"Andreessen Horowitz, F-Prime Capital, Venrock"
Tresata,$1B,10-10-2018,Fintech,Charlotte,United States,North America,2011,$51M,GCP Capital Partners
CloudWalk Technology,$5B,08-10-2018,Artificial intelligence,Guangzhou,China,Asia,2015,$514M,"Oriza Holdings, Guangdong Technology Financial Group"
Brex,$12B,05-10-2018,Fintech,San Francisco,United States,North America,2017,$1B,"DST Global, Ribbit Capital, Greenoaks Capital Management"
Talkdesk,$10B,03-10-2018,Internet software & services,San Francisco,United States,North America,2011,$497M,"DJF, Salesforce Ventures, Storm Ventures"
OYO Rooms,$10B,25-09-2018,Travel,Gurugram,India,Asia,2012,$3B,"SoftBank Group, Sequoia Capital India,Lightspeed India Partners"
Convoy,$3B,21-09-2018,"Supply chain, logistics, & delivery",Seattle,United States,North America,2015,$666M,"Greylock Partners, capitalG, Y Combinator"
Yijiupi,$1B,20-09-2018,Consumer & retail,Beijing,China,Asia,2014,$511M,"Source Code Capital, Meituan Dianping, Tencent Holdings"
Nxin,$1B,18-09-2018,Internet software & services,Beijing,China,Asia,2015,$53M,"Beijing Juneng Hesheng Industry Investment Fund, Beijing Shuju Xinrong Fund"
Tuhu,$1B,15-09-2018,Auto & transportation,Shanghai,China,Asia,2011,$875M,"Qiming Venture Partners, Yaxia Automobile, Far East Horizon"
Banma Network Technologies,$1B,13-09-2018,Auto & transportation,Shanghai,China,Asia,2015,$697M,"Yunfeng Capital, SDIC Innovation Investment Management, Shang Qi Capital"
Branch,$4B,10-09-2018,Mobile & telecommunications,Redwood City,United States,North America,2014,$667M,"New Enterprise Associates, Pear, Cowboy Ventures"
Udaan,$3B,04-09-2018,"Supply chain, logistics, & delivery",Bengaluru,India,Asia,2016,$1B,"DST Global, Lightspeed Venture Partners, Microsoft ScaleUp"
Rappi,$5B,31-08-2018,"Supply chain, logistics, & delivery",Bogota,Colombia,South America,2015,$2B,"DST Global, Andreessen Horowitz, Sequoia Capital, Redpoint e.ventures"
FlashEx,$1B,27-08-2018,"Supply chain, logistics, & delivery",Beijing,China,Asia,2014,$359M,"Prometheus Capital, Matrix Partners China, JD Capital Management"
Klook,$1B,07-08-2018,Travel,Central,Hong Kong,Asia,2014,$722M,"Sequoia Capital China, Goldman Sachs, Matrix Partners China"
Biosplice Therapeutics,$12B,06-08-2018,Health,San Diego,United States,North America,2008,$799M,"Vickers Venture Partners, IKEA GreenTech"
Deezer,$1B,02-08-2018,Internet software & services,Paris,France,Europe,2007,$532M,"Orange Digital Ventures, Access Industries"
Formlabs,$2B,01-08-2018,Hardware,Somerville,United States,North America,2011,$251M,"Pitango Venture Capital, DFJ Growth Fund, Foundry Group"
Medlinker,$4B,31-07-2018,Health,Chengdu,China,Asia,2014,$761M,"China Health Industry Investment Fund, China Renaissance, and Sequoia Capital China"
Unisound,$1B,19-07-2018,Artificial intelligence,Beijing,China,Asia,2012,$361M,"Qiming Venture Partners, China Internet Investment Fund, Qualcomm Ventures"
Zuoyebang,$10B,18-07-2018,Edtech,Beijing,China,Asia,2014,$3B,"Sequoia Capital China, Xiang He Capital, GGV Capital"
Wacai,$1B,18-07-2018,Mobile & telecommunications,Hangzhou,China,Asia,2009,$369M,"Qiming Venture Partners, China Broadband Capital, CDH Investments"
Greensill,$4B,16-07-2018,Fintech,London,United Kingdom,Europe,2011,$2B,"SoftBank Group, General Atlantic"
Pat McGrath Labs,$1B,16-07-2018,Consumer & retail,New York,United States,North America,2016,$60M,"One Luxury Group, Eurazeo"
Kuaigou Dache,$1B,13-07-2018,"Supply chain, logistics, & delivery",Tianjin,China,Asia,2014,$650M,"Sequoia Capital China, InnoVision Capital, Qianhai Fund of Funds"
Movile,$1B,12-07-2018,Mobile & telecommunications,Sao Paulo,Brazil,South America,1998,$588M,"Innova Capital - FIP, 3G Capital Management, Prosus Ventures"
Pony.ai,$9B,11-07-2018,Artificial intelligence,Fremont,United States,North America,2016,$1B,"Sequoia Capital China, IDG Capital, DCM Ventures"
MediaMath,$1B,10-07-2018,Internet software & services,New York,United States,North America,2007,$325M,"Silicon Valley Bank, QED Investors, European Founders Fund"
Jusfoun Big Data,$2B,09-07-2018,Data management & analytics,Beijing,China,Asia,2010,$137M,"Boxin Capital, DT Capital Partners, IDG Capital"
Bitmain,$12B,06-07-2018,Hardware,Beijing,China,Asia,2015,$765M,"Coatue Management, Sequoia Capital China, IDG Capital"
LinkDoc Technology,$1B,05-07-2018,Health,Beijing,China,Asia,2014,$253M,"China Investment Corporation, New Enterprise Associates"
SHEIN,$100B,03-07-2018,E-commerce & direct-to-consumer,Shenzhen,China,Asia,2008,$2B,"Tiger Global Management, Sequoia Capital China, Shunwei Capital Partners"
Automation Anywhere,$7B,02-07-2018,Artificial intelligence,San Jose,United States,North America,2003,$849M,"General Atlantic, Goldman Sachs, New Enterprise Associates"
Celonis,$11B,26-06-2018,Data management & analytics,Munich,Germany,Europe,2011,$1B,"Accel, 83North"
Swiggy,$11B,21-06-2018,"Supply chain, logistics, & delivery",Bengaluru,India,Asia,2014,$5B,"Accel India, SAIF Partners, Norwest Venture Partners"
